issuer,Idate,Fdate,ISIN,ticker,SIC,LCS Key,LevDis Key,LCS,LevDis Value,LCS Value,Full Name,Name,Symbol,Start Date,DATASTREAM CODE,LOC OFF. CODE,ISIN CODE
Golden Throat Hldg Grp Co Ltd,2015/6/30,2015/3/3,KYG3961J1022,6896,2834,Golden Throat Hldg Grp Co Ltd,0,goldenthroat,0,Golden Throat Holdings Group,Golden Throat Holdings Group,GOLDEN THROAT HDG.GROUP,K:GTHG,2015/7/15,9748WG,HK6896,KYG3961J1022
Harmonicare Med Hldg Ltd,2015/7/1,2015/3/23,KYG439691075,1509,8069,Harmonicare Med Hldg Ltd,0,harmonicaremed,0,Harmonicare Medical Holdings,Harmonicare Medical Holdings,HARMONICARE MEDICAL HDG.,K:HARM,2015/7/7,97447K,HK1509,KYG439691075
Man King Holdings Ltd,2015/7/2,2015/6/19,,2193,1522,Man King Holdings Ltd,0,manking,0,Man King Holdings,Man King Holdings,MAN KING HOLDINGS,K:MANK,2015/7/3,9663MR,HK2193,NA
Tsaker Chemical Group Ltd,2015/7/2,2015/6/23,KYG910801045,1986,2899,Tsaker Chemical Group Ltd,0,tsakerchemical,0,Tsaker Chemical Group,Tsaker Chemical Group,TSAKER CHEMICAL GROUP,K:TSAK,2015/7/3,9734NG,HK1986,KYG910801045
Purapharm Corp Ltd,2015/7/6,2015/6/25,KYG7306Y1044,1498,2834,Purapharm Corp Ltd,0,purapharm,0,Purapharm,Purapharm,PURAPHARM,K:PURA,2015/7/8,97447L,HK1498,KYG7306Y1044
Tianyun Intl Hldg Ltd,2015/7/6,2015/6/24,VGG8880B1067,6836,2037,Tianyun Intl Hldg Ltd,0,tianyun,0,Tianyun International Holdings,Tianyun International Holdings,TIANYUN INTL.HOLDINGS,K:TIYU,2015/7/7,9742L2,HK6836,VGG8880B1067
Zhongzhi Pharm Hldg Ltd,2015/7/10,2015/6/30,KYG989611085,3737,2834,Zhongzhi Pharm Hldg Ltd,0,zhongzhipharm,0,Zhongzhi Pharmaceutical Holdings,Zhongzhi Pharmaceutical Holdings,ZHONGZHI PHARM.HOLDINGS,K:ZZZZ,2015/7/13,9748WE,HK3737,KYG989611085
Wan Kei Group Holdings Ltd,2015/8/7,2015/7/27,,1718,1522,Wan Kei Group Holdings Ltd,0,wankei,0,Wan KEI Group Holdings,Wan KEI Group Holdings,WAN KEI GROUP HOLDINGS,K:WANK,2015/8/11,9828J8,HK1718,KYG943081060
China Shun Ke Long Hldg Ltd,2015/9/9,2015/5/12,KYG2163D1034,974,5411,China Shun Ke Long Hldg Ltd,0,chinashunkelong,0,China Shun KE Long Holdings,China Shun KE Long Holdings,CHINA SHUN KE LONG HDG.,K:CSKL,2015/9/10,9922Q6,HK974,KYG2163D1034
Regina Miracle Intl (Hldg) Ltd,2015/9/30,2015/9/16,KYG748071019,2199,2342,Regina Miracle Intl (Hldg) Ltd,0,reginamiracle,0,Regina Miracle International (Holdings),Regina Miracle International (Holdings),REGINA MIRACLE INTL. (HDG.),K:RMIL,2015/10/8,9935D9,HK2199,KYG748071019
Zhejiang Tengy Envi Tech Co,2015/10/9,2015/9/24,CNE1000021Y6,1527,9511,Zhejiang Tengy Envi Tech Co,0,zhejiangtengyen,0,Zhejiang Tengy Environmental Technology Company 'H',Zhejiang Tengy Environmental Technology Company 'H',ZHEJIANG TENGY ENV.TECH. CO.'H',K:ZTET,2015/10/12,9935EA,HK1527,CNE1000021Y6
China Partytime Culture Holdin,2015/10/15,2015/9/30,KYG2163R1020,1532,2331,China Partytime Culture Holdin,0,chinapartytimec,0,China Partytime Culture Holdings,China Partytime Culture Holdings,CHINA PARTYTIME CULTURE HDG.,K:CPCT,2015/10/16,8650W2,HK1532,KYG2163R1020
Denox Envi & Tech Hldg Ltd,2015/11/6,2015/10/29,KYG2810N1088,1452,3914,Denox Envi & Tech Hldg Ltd,0,denoxenvi,0,Denox Environmental and Technology Holdings,Denox Environmental and Technology Holdings,DENOX ENV.& TECH.HDG.,K:DENX,2015/11/12,8708NQ,HK1452,KYG2810N1088
Chinney Kin Wing Holdings Ltd,2015/11/10,2015/8/19,BMG2118K1036,1556,1522,Chinney Kin Wing Holdings Ltd,0,chinneykinwing,0,Chinney KIN Wing Holdings,Chinney KIN Wing Holdings,CHINNEY KIN WING HDG.,K:KINW,2015/11/11,8708NV,HK1556,BMG2118K1036
Dali Foods Group Company Ltd,2015/11/14,2015/7/3,KYG2743Y1061,3799,2052,Dali Foods Group Company Ltd,0,dalifoods,0,Dali Foods Group Company,Dali Foods Group Company,DALI FOODS GROUP CO.,K:DALF,2015/11/20,8721RN,HK3799,KYG2743Y1061
Manfield Chemical Holdings Ltd,2015/11/17,2015/10/13,,1561,3479,Manfield Chemical Holdings Ltd,0,manfieldchemica,0,Manfield Chemical Holdings,Manfield Chemical Holdings,MANFIELD CHEMICAL HDG.,K:MACF,2015/12/1,8735AW,HK1561,NA
UMP Healthcare Holdings Ltd,2015/11/23,2015/9/10,KYG9320W1069,722,8099,UMP Healthcare Holdings Ltd,0,umphealthcare,0,UMP Healthcare Holdings,UMP Healthcare Holdings,UMP HEALTHCARE HOLDINGS,K:UMPH,2015/11/27,8735AV,HK722,KYG9320W1069
Fse Engineering Holdings Ltd,2015/12/9,2015/9/9,KYG3727N1088,331,8711,Fse Engineering Holdings Ltd,0,fseengineering,0,FSE Engineering Holdings,FSE Engineering Holdings,FSE ENGINEERING HDG.,K:FSEE,2015/12/10,8745C8,HK331,KYG3727N1088
SFK Construction Holdings Ltd,2015/12/9,2015/9/8,BMG8059A1119,1447,1541,SFK Construction Holdings Ltd,0,sfkconstruction,0,SFK Construction Holdings,SFK Construction Holdings,SFK CONSTRUCTION HDG.,K:SFKH,2015/12/10,8751TX,HK1447,BMG8059A1036
CRCC High-Tech Equip Corp,2015/12/9,2015/8/7,CNE1000023F1,1786,3531,CRCC High-Tech Equip Corp,0,crcchigh-tech,0,CRCC High-Technology Equipment 'H',CRCC High-Technology Equipment 'H',CRCC HIGH-TECH EQUIPMENT 'H',K:CRXX,2015/12/16,8764Q5,HK1786,CNE1000023F1
Ten Pao Group Holdings Ltd,2015/12/10,2015/11/30,KYG876031090,1979,3679,Ten Pao Group Holdings Ltd,0,tenpao,0,Ten Pao Group Holdings,Ten Pao Group Holdings,TEN PAO GP.HDG.,K:TPGH,2015/12/11,8751TV,HK1979,KYG876031090
Modern Dental Group Ltd,2015/12/10,2015/12/3,KYG618201092,3600,3843,Modern Dental Group Ltd,0,moderndental,0,Modern Dental Group,Modern Dental Group,MODERN DENTAL GROUP,K:MDGL,2015/12/15,8764Q3,HK3600,KYG618201092
Charmacy Pharmaceutical Co Ltd,2015/12/11,2015/9/7,CNE1000023D6,2289,5122,Charmacy Pharmaceutical Co Ltd,0,charmacypharmac,0,Charmacy Pharmaceutical Company 'H',Charmacy Pharmaceutical Company 'H',CHARMACY PHARM.CO.'H',K:CHUP,2015/12/14,8757U6,HK2289,CNE1000023D6
China Hengshi Foundation Co,2015/12/12,2015/12/3,KYG2118L1014,1197,2221,China Hengshi Foundation Co,0,chinahengshifou,0,China Hengshi Foundation Company,China Hengshi Foundation Company,CHINA HENGSHI FOUNDATION CO.,K:CSHN,2015/12/21,8799D5,HK1197,KYG2118L1014
Yee Hop Holdings Ltd,2015/12/17,2015/12/7,KYG9836P1081,1662,1542,Yee Hop Holdings Ltd,0,yeehop,0,Yee Hop Holdings,Yee Hop Holdings,YEE HOP HOLDINGS,K:YEEH,2015/12/18,8792J1,HK1662,KYG9836P1081
Feishang Non-metal Materials,2015/12/28,2015/9/24,KYG337641040,8331,1459,Feishang Non-metal Materials,0,feishangnon-met,0,Feishang Non-Metal Materials Technology,Feishang Non-Metal Materials Technology,FEISHANG NON-METAL MATS. TECH.,K:FEIS,2015/12/29,8827JW,HK8331,KYG337641040
Yichang Hec Changjiang Pharm,2015/12/28,2015/9/29,CNE1000023R6,1558,2834,Yichang Hec Changjiang Pharm,0,yichanghecchang,0,Yichang HEC Changjiang Pharmaceutical Company 'H',Yichang HEC Changjiang Pharmaceutical Company 'H',YICHANG HEC CHANGJIANG PHARM.CO.'H',K:YHEC,2015/12/29,8827JH,HK1558,CNE1000023R6
Sundart Holdings Ltd,2015/12/28,2015/5/4,VGG857251026,1568,1522,Sundart Holdings Ltd,0,sundart,0,Sundart Holdings,Sundart Holdings,SUNDART HOLDINGS,K:SUDR,2015/12/29,8776Y2,HK1568,VGG857251026
Perfect Grp Intl Hldg Ltd,2015/12/31,2015/9/18,KYG700671061,3326,3479,Perfect Grp Intl Hldg Ltd,0,perfect,0,Perfect Group International Holdings,Perfect Group International Holdings,PERFECT GROUP INTERNATIONAL HOLDINGS,K:PERI,2016/1/4,8827JP,HK3326,KYG700671145
Virscend Education Co Ltd,2016/1/8,2015/9/10,KYG936691024,1565,8211,Virscend Education Co Ltd,0,virscendeducati,0,Virscend Education Company,Virscend Education Company,VIRSCEND EDUCATION CO.,K:VECL,2016/1/15,8840ET,HK1565,KYG936691024
Jujiang Constr Grp Co Ltd,2016/1/11,2015/9/16,,1459,1522,Jujiang Constr Grp Co Ltd,0,jujiangconstr,0,Jujiang Construction Group Company 'H',Jujiang Construction Group Company 'H',JUJIANG CONSTRUCTION GP. CO.'H',K:JUJI,2016/1/12,8830VU,HK1459,CNE100002417
Sinco Pharms Hldg Ltd,2016/3/4,2015/9/30,,6833,5122,Sinco Pharms Hldg Ltd,0,sincopharm,0,Sinco Pharmaceuticals Holdings,Sinco Pharmaceuticals Holdings,SINCO PHARMS.HDG.,K:SIPH,2016/3/10,8952FE,HK6833,KYG8154Y1052
Union Medical Healthcare Ltd,2016/3/7,2015/11/5,KYG9320L1005,2138,8062,Union Medical Healthcare Ltd,0,unionmedicalhea,0,Union Medical Healthcare,Union Medical Healthcare,UNION MEDICAL HEALTHCARE,K:UMHL,2016/3/11,8952CV,HK2138,KYG9320L1005
Human Health Holdings Ltd,2016/3/31,2015/10/27,KYG4644Q1091,1419,8099,Human Health Holdings Ltd,0,humanhealth,0,Human Health Holdings,Human Health Holdings,HUMAN HEALTH HDG.,K:HHHL,2016/4/1,7018K6,HK1419,KYG4644Q1091
Nameson Holdings Ltd,2016/4/6,2015/10/8,KYG6362E1017,1982,2258,Nameson Holdings Ltd,0,nameson,0,Nameson Holdings,Nameson Holdings,NAMESON HOLDINGS,K:NHL,2016/4/12,7077U7,HK1982,KYG6362E1017
AP Rentals Holdings Ltd,2016/4/7,2015/12/17,KYG0501C1006,1496,7359,AP Rentals Holdings Ltd,0,aprentals,0,AP Rentals Holdings,AP Rentals Holdings,AP RENTALS HOLDINGS,K:APRH,2016/4/8,7027M8,HK1496,KYG0501C1006
Huajin Intl Hldg Ltd,2016/4/14,2016/1/5,,2738,3312,Huajin Intl Hldg Ltd,0,huajin,0,Huajin International,Huajin International,HUAJIN INTL.,K:HUIH,2016/4/15,7084PV,HK2738,KYG464211062
Yadea Group Holdings Ltd,2016/5/16,2015/9/1,KYG9830F1063,1585,3751,Yadea Group Holdings Ltd,0,yadea,0,Yadea Group Holdings,Yadea Group Holdings,YADEA GROUP HDG.,K:YADE,2016/5/19,7405PN,HK1585,KYG9830F1063
Hang Sang (Siu Po) Intl Hldg,2016/5/17,2015/12/16,KYG4288S1066,3626,3552,Hang Sang (Siu Po) Intl Hldg,0,hangsangsiupo,0,Hang Sang (SIU Po) International,Hang Sang (SIU Po) International,HANG SANG (SIU PO) INTL.,K:HSA,2016/5/18,7298WD,HK3626,KYG4288S1066
BOC Aviation Ltd,2016/5/19,2015/10/19,,2588,7359,BOC Aviation Ltd,0,bocaviation,0,BOC Aviation,BOC Aviation,BOC AVIATION,K:BOCA,2016/6/1,7294AL,HK2588,SG9999015267
Li Bao Ge Group Ltd,2016/6/29,2015/9/25,,8102,5812,Li Bao Ge Group Ltd,0,libaoge,0,Li Bao GE Group,Li Bao GE Group,LI BAO GE GROUP,K:LBGG,2016/6/30,7588G4,HK8102,KYG548041022
Ever Harvest Grp Hldg Ltd,2016/7/6,2016/3/9,KYG3227D1051,1549,4412,Ever Harvest Grp Hldg Ltd,0,everharvest,0,Ever Harvest Group Holdings,Ever Harvest Group Holdings,EVER HARVEST GP.HDG.,K:EHGH,2016/7/6,7586D3,HK1549,KYG3227D1051
Yihai Intl Hldg Ltd,2016/7/7,2016/4/1,KYG984191075,1579,2099,Yihai Intl Hldg Ltd,0,yihai,0,Yihai International Holding,Yihai International Holding,YIHAI INTL.HLDG.,K:YIHA,2016/7/13,7720DU,HK1579,KYG984191075
China Logistics Ppty Hldg Co,2016/7/8,2016/3/30,KYG212091048,1589,4215,China Logistics Ppty Hldg Co,0,chinalogisticsp,0,China Logistics Property Holdings,China Logistics Property Holdings,CHINA LOGIST.PR.HDG.,K:CLPH,2016/7/15,7720FV,HK1589,KYG212091048
China Leon Inspection Hldg Ltd,2016/7/11,2016/2/4,KYG2163G1064,1586,1241,China Leon Inspection Hldg Ltd,0,chinaleoninspec,0,China Leon Inspection,China Leon Inspection,CHINA LEON INSPEC.,K:CLIH,2016/7/12,7715GD,HK1586,KYG2163G1064
Vincent Medical Holdings Ltd,2016/7/12,2016/4/4,KYG9367D1025,1612,3841,Vincent Medical Holdings Ltd,0,vincentmedical,0,Vincent Medical Holdings,Vincent Medical Holdings,VINCENT MEDICAL HDG.,K:VMED,2016/7/13,7720DW,HK1612,KYG9367D1025
China Unienergy Group Ltd,2016/7/12,2016/4/20,KYG212081064,1573,1221,China Unienergy Group Ltd,0,chinaunienergy,0,China Unienergy Group,China Unienergy Group,CHINA UNIENERGY GP.,K:CUGL,2016/7/13,7720F1,HK1573,KYG212081064
Prosper Constr Hldg Ltd,2016/7/19,2016/3/31,,6816,1541,Prosper Constr Hldg Ltd,0,prosperconstr,0,Prosper Construction Holdings,Prosper Construction Holdings,PROSPER CON.HDG.,K:PCHL,2016/7/20,7720F3,HK6816,KYG7279E1017
Ausupreme Intl Hldg Ltd,2016/9/9,2015/12/4,KYG066021091,2031,5149,Ausupreme Intl Hldg Ltd,0,ausupreme,0,Ausupreme International Holdings,Ausupreme International Holdings,AUSUPREME INTL.HDG.,K:ASPI,2016/9/12,7749DQ,HK2031,KYG066021091
Crosstec Group Holdings Ltd,2016/9/9,2016/3/23,KYG257501034,3893,7389,Crosstec Group Holdings Ltd,0,crosstec,0,Crosstec Group Holdings,Crosstec Group Holdings,CROSSTEC GROUP HDG.,K:CRSS,2016/9/12,25614G,HK3893,KYG257501034
Jacobson Pharma Corp Ltd,2016/9/14,2016/4/18,KYG677291067,2633,5912,Jacobson Pharma Corp Ltd,0,jacobsonpharma,0,Jacobson Pharma Corporation,Jacobson Pharma Corporation,JACOBSON PHARMA CORP.,K:JCBS,2016/9/21,2569FZ,HK2633,KYG677291067
Rici Healthcare Holdings Ltd,2016/9/30,2016/3/21,,1526,8062,Rici Healthcare Holdings Ltd,0,ricihealthcare,0,Rici Healthcare Holdings,Rici Healthcare Holdings,RICI HEALTHCARE HDG.,K:RICI,2016/10/6,2620N3,HK1526,KYG755601054
Cherish Holdings Ltd,2016/9/30,2016/6/17,KYG2090D1016,2113,1794,Cherish Holdings Ltd,0,cherish,0,Cherish Holdings,Cherish Holdings,CHERISH HOLDINGS,K:CHSH,2016/10/17,2625M5,HK2113,KYG2090D1016
China Resources Pharm Grp Ltd,2016/10/21,2016/10/17,HK0000311099,3320,2834,China Resources Pharm Grp Ltd,0,chinaresourcesp,0,China Resources Power Holdings,China Resources Power Holdings,CHINA RES.POWER HDG.,K:CREP,2003/11/12,27962U,HK836,HK0836012952
JNBY Design Ltd,2016/10/25,2016/7/6,KYG550441045,3306,2299,JNBY Design Ltd,0,jnbydesign,0,Jnby Design,Jnby Design,JNBY DESIGN,K:JNBY,2016/10/31,2637YH,HK3306,KYG550441045
COFCO Meat Holdings Ltd,2016/10/26,2016/6/28,KYG226921008,1610,5147,COFCO Meat Holdings Ltd,0,cofcomeat,0,Cofco Meat Holdings,Cofco Meat Holdings,COFCO MEAT HOLDINGS,K:CFML,2016/11/1,2637YJ,HK1610,KYG226921008
Guangdong Kanghua Healthcare,2016/11/2,2016/7/14,,3689,8062,Guangdong Kanghua Healthcare,0,guangdongkanghu,0,Guangdong Kanghua Healthcare 'H',Guangdong Kanghua Healthcare 'H',GUANGDONG KANGHUA HEALTHCARE 'H',K:GNGD,2016/11/8,2644YL,HK3689,CNE100002B55
Gemilang International Ltd,2016/11/9,2016/7/22,,6163,3713,Gemilang International Ltd,0,gemilang,0,Gemilang International,Gemilang International,GEMILANG INTERNATIONAL,K:GMLG,2016/11/11,2653NH,HK6163,KYG378791068
Zhou Hei Ya Intl Hldg Co Ltd,2016/11/10,2016/6/23,,1458,5311,Zhou Hei Ya Intl Hldg Co Ltd,0,zhouheiya,0,Zhou HEI Ya International Holdings,Zhou HEI Ya International Holdings,ZHOU HEI YA INTL.HDG.,K:ZHYI,2016/11/11,2656TM,HK1458,KYG989761062
Sheung Yue Group Holdings Ltd,2016/11/10,2016/6/28,,1633,1794,Sheung Yue Group Holdings Ltd,0,sheungyue,0,Sheung Yue Group,Sheung Yue Group,SHEUNG YUE GROUP,K:SHYE,2016/11/11,2653NJ,HK1633,KYG8100F1019
VPower Grp Intl Hldg Ltd,2016/11/18,2016/5/26,,1608,3621,VPower Grp Intl Hldg Ltd,0,vpower,0,Vpower Group International,Vpower Group International,VPOWER GROUP INTL.,K:VPWR,2016/11/24,2731AY,HK1608,KYG939541085
Pantronics Holdings Ltd,2016/11/18,2016/4/27,,1611,3679,Pantronics Holdings Ltd,0,pantronics,0,Pantronics Holdings,Pantronics Holdings,PANTRONICS HOLDINGS,K:PNTR,2016/11/21,2724H6,HK1611,VGG6891S1002
Guangdong Adway Constr (Grp),2016/11/24,2015/10/15,,6189,8712,Guangdong Adway Constr (Grp),0,guangdongadwayc,0,Guangdong Adway Construction 'H' (Group),Guangdong Adway Construction 'H' (Group),GUANGDONG ADWAY CON.'H' (GROUP),K:GDWY,2016/11/25,2733HF,HK6189,CNE100002B71
Mengke Holdings Ltd,2016/11/24,2016/3/21,,1629,2111,Mengke Holdings Ltd,0,mengke,0,Mengke Holdings,Mengke Holdings,MENGKE HOLDINGS,K:MNGK,2016/11/25,2733J3,HK1629,NA
Food Wise Holdings Ltd,2016/11/28,2016/6/21,,1632,5812,Food Wise Holdings Ltd,0,foodwise,0,Food Wise Holdings,Food Wise Holdings,FOOD WISE HOLDINGS,K:FDWS,2016/11/29,2736FJ,HK1632,KYG361851093
Progressive Path Grp Hldg Ltd,2016/12/7,2016/7/20,,1581,1542,Progressive Path Grp Hldg Ltd,0,progressivepath,0,Progressive Path Group,Progressive Path Group,PROGRESSIVE PATH GROUP,K:PRTH,2016/12/8,2748G6,HK1581,KYG725391026
Nanfang Commun Hldg Ltd,2016/12/9,2016/7/5,,1617,3357,Nanfang Commun Hldg Ltd,0,nanfangcommun,0,Nanfang Communication,Nanfang Communication,NANFANG COMMUNICATION,K:NNFG,2016/12/12,2750Y3,HK1617,KYG6390W1078
Hebei Yichen Industrial Grp,2016/12/16,2016/3/23,,1596,3493,Hebei Yichen Industrial Grp,0,hebeiyichenindu,0,Hebei Yichen Industrial Group,Hebei Yichen Industrial Group,HEBEI YICHEN INDL.GP.,K:HBEY,2016/12/21,2768HG,HK1596,CNE100002B30
Golden Resources Dvlp Intl Ltd,1991/1/11,1991/1/11,,677,2044,Golden Resources Dvlp Intl Ltd,0,goldenresources,0,Golden Resources Development International,Golden Resources Development International,GOLDEN RES.DEV.INTL.,K:GDEV,1991/1/28,539920,HK677,BMG3958B1046
Giordano Holdings Ltd,1991/5/28,1991/5/28,,709,5611,Giordano Holdings Ltd,0,giordano,0,Giordano International,Giordano International,GIORDANO INTL.,K:GIOR,1991/6/19,314874,HK709,BMG6901M1010
Truly International,1991/6/11,1991/6/11,,TRULY,3571,Truly International,0,truly,0,Truly International Holdings,Truly International Holdings,TRULY INTL.HDG.,K:TRUL,1991/7/29,314154,HK732,KYG910191363
Varitronix Intl Ltd,1991/6/11,1991/6/11,,710,3679,Varitronix Intl Ltd,0,varitronix,0,BOE Varitronix,BOE Varitronix,BOE VARITRONIX,K:VARI,1991/7/1,314888,HK710,BMG1223L1054
Lam Soon Food Inds Ltd,1991/7/3,1991/7/3,BMG5358B1138,728,5461,Lam Soon Food Inds Ltd,0,lamsoonfood,0,Lam Soon Food,Lam Soon Food,LAM SOON FOOD,K:FOOD,1991/7/24,314139,NA,BMG5358B1054
Orient Power Holdings Ltd,1991/8/16,1991/8/16,,615,3651,Orient Power Holdings Ltd,0,orientpower,0,Orient Power Holdings,Orient Power Holdings,ORIENT POWER HOLDINGS,K:ORNT,1991/9/2,314522,HK615,BMG677481068
Innovative Intl(Hldg)ltd,1991/9/17,1991/9/17,,729,5013,Innovative Intl(Hldg)ltd,0,innovative,0,Innovative Pharmaceutical Biotech,Innovative Pharmaceutical Biotech,INNOVATIVE PHARM.BIOT.,K:FEPT,2000/8/23,297026,HK399,BMG4783W1073
Fairwood Holdings Ltd,1991/9/20,1991/9/20,,52,5812,Fairwood Holdings Ltd,0,fairwood,0,Fairwood Holdings,Fairwood Holdings,FAIRWOOD HOLDINGS,K:FAIR,1991/10/9,314064,HK52,BMG3305Y1619
Chen Hsong Holdings Ltd,1991/9/30,1991/9/30,,57,3599,Chen Hsong Holdings Ltd,0,chenhsong,0,Chen Hsong Holdings,Chen Hsong Holdings,CHEN HSONG HDG.,K:CHEN,1991/10/22,314066,HK57,BMG208741063
Top Form International Ltd,1991/11/26,1991/11/26,,333,2342,Top Form International Ltd,0,topform,0,Top Form International,Top Form International,TOP FORM INTL.,K:FORM,1991/12/16,315143,HK333,BMG8922H1299
Pak Fah Yeow International Ltd,1991/12/3,1991/12/3,,239,2833,Pak Fah Yeow International Ltd,0,pakfahyeow,0,PAK FAH Yeow International,PAK FAH Yeow International,PAK FAH YEOW INTL.,K:PFYI,1991/12/18,315155,HK239,BMG6873Y1176
Kong Wah Holdings,1992/1/13,1992/1/13,,359,3651,Kong Wah Holdings,0,kongwah,0,Kong Wah,Kong Wah,KONG WAH,K:KONG,1992/1/28,315504,NA,BMG5308Z1032
Hung Hing Printing Group Ltd,1992/2/27,1992/2/27,XC0008849132,450,2671,Hung Hing Printing Group Ltd,0,hunghingprintin,0,Hung Hing Printing Group,Hung Hing Printing Group,HUNG HING PRINT.GP.,K:HUNG,1992/3/16,315591,HK450,HK0450001869
Li & Fung Ltd,1992/6/9,1992/6/9,,494,5099,Li & Fung Ltd,0,lifung,0,Li and Fung,Li and Fung,LI & FUNG,K:FUNG,1992/7/1,315769,HK494,BMG5485F1692
Yue Yuen Industrial(Hldg)Ltd,1992/6/16,1992/6/16,BMG988031024,551,3021,Yue Yuen Industrial(Hldg)Ltd,0,yueyuenindustri,0,Yue Yuen Industrial Holdings,Yue Yuen Industrial Holdings,YUE YUEN INDL.HDG.,K:YUEN,1992/7/2,315775,HK551,BMG988031446
China Merchants Hai Hong Hldgs,1992/6/30,1992/6/30,XC0008845585,144,2851,China Merchants Hai Hong Hldgs,0,chinamerchants,0,China Merchants Port Holdings,China Merchants Port Holdings,CHINA MRCH.POR.HDG.,K:HAIH,1992/7/15,315805,HK144,HK0144000764
Texwinca Holdings Ltd,1992/7/20,1992/7/20,BMY861151215,321,2231,Texwinca Holdings Ltd,0,texwinca,0,Texwinca Holdings,Texwinca Holdings,TEXWINCA HOLDINGS,K:TEXW,1992/8/6,316074,HK321,BMG8770Z1068
High Fashion International Ltd,1992/7/21,1992/7/21,,608,2331,High Fashion International Ltd,0,highfashion,0,High Fashion International,High Fashion International,HIGH FASHION INTL.,K:HFIN,1992/8/4,316075,HK608,BMG4453K1027
Champion Tech Hldg Ltd,1992/8/3,1992/8/3,,92,4812,Champion Tech Hldg Ltd,0,champion,0,Champion Real Estate Investment Trust,Champion Real Estate Investment Trust,CHAMPION REIT.TRUST,K:CREI,2006/5/24,35931N,HK2778,HK2778034606
Goldlion Holdings Ltd,1992/9/2,1992/9/2,XC0008848985,533,2311,Goldlion Holdings Ltd,0,goldlion,0,Goldlion Holdings,Goldlion Holdings,GOLDLION HOLDINGS,K:LION,1992/9/18,316138,HK533,HK0533002009
Pico Far East Holdings Ltd,1992/9/14,1992/9/14,,PICO,2542,Pico Far East Holdings Ltd,0,picofareast,0,Pico Far East Holdings,Pico Far East Holdings,PICO FAR EAST HOLDINGS,K:PICO,1992/9/28,316148,HK752,KYG7082H1276
MC Packaging(Hong Kong)Ltd,1992/9/22,1992/9/22,XC0008849819,751,3411,MC Packaging(Hong Kong)Ltd,0,mcpackaging,0,MC Packaging Hong Kong,MC Packaging Hong Kong,MC PACKAGING HK.,316246,1992/10/14,316246,NA,HK0751002293
Perfectech Intl Hldg Ltd,1992/10/8,1992/10/8,,765,3999,Perfectech Intl Hldg Ltd,0,perfectech,0,Perfectech International Holdings,Perfectech International Holdings,PERFECTECH INTL.HDG.,K:PFIH,1992/10/23,316264,HK765,BMG7004C1073
Star Ent Intl Hldg Ltd,1992/10/27,1992/10/27,,326,7822,Star Ent Intl Hldg Ltd,0,starent,0,China Star Entertainment,China Star Entertainment,CHINA STAR ENTM.,K:STAE,1992/11/12,316268,HK326,BMG8437G3195
Le Saunda Holdings Ltd,1992/11/26,1992/11/26,,738,3144,Le Saunda Holdings Ltd,0,lesaunda,0,Le Saunda Holdings,Le Saunda Holdings,LE SAUNDA HOLDINGS,K:LESA,1992/12/11,316334,HK738,BMG5456B1063
Leading Spirit(Holdings)Co Ltd,1992/12/31,1992/12/31,,606,3663,Leading Spirit(Holdings)Co Ltd,0,leadingspirit,0,Leading Spirit High-Technology,Leading Spirit High-Technology,LEADING SPIRIT HIGH-TECH,K:LEDS,1993/1/18,316592,NA,BMG5412S1026
Group Sense(International)Ltd,1993/1/12,1993/1/12,,601,3679,Group Sense(International)Ltd,0,groupsense,0,Group Sense International,Group Sense International,GROUP SENSE INTL.,K:GRSE,1993/1/28,316595,HK601,BMG4145B1063
Peace Mark(Holdings)Ltd,1993/2/2,1993/2/2,,304,3873,Peace Mark(Holdings)Ltd,0,peacemark,0,Peace Mark (Holdings),Peace Mark (Holdings),PEACE MARK (HDG.),K:PECE,1993/2/18,316640,HK304,NA
Denway Investment Ltd,1993/2/5,1993/2/5,HK0203001067,203,3714,Denway Investment Ltd,0,investmen,0,Investment Trust,Investment Trust,I T,K:ITLT,2005/3/4,30374C,NA,NA
World Houseware(Holdings)Ltd,1993/3/29,1993/3/29,,713,2392,World Houseware(Holdings)Ltd,0,worldhouseware,0,World Houseware (Holdings),World Houseware (Holdings),WORLD HOUSEWARE (HDG.),K:WORA,1993/4/15,316821,HK713,KYG9768F1028
Golden Power Intl Hldg Ltd,1993/5/17,1993/5/17,BMG4616K1229,603,3674,Golden Power Intl Hldg Ltd,0,goldenpower,0,Golden Power Group Holdings,Golden Power Group Holdings,GOLDEN POWER GROUP HDG.,K:GPGH,2015/6/5,9528QT,HK3919,KYG3959Y1035
Shangri-La Asia Ltd,1993/5/31,1993/5/31,,69,7011,Shangri-La Asia Ltd,0,shangri-laasia,0,Shangri-La Asia,Shangri-La Asia,SHANGRI-LA ASIA,K:SLAS,1993/6/17,317483,HK69,BMG8063F1068
Singamas Container Holdings,1993/6/23,1993/6/23,HK0716002271,716,2655,Singamas Container Holdings,0,singamascontain,0,Singamas Container Holdings,Singamas Container Holdings,SINGAMAS CONTAINER HDG.,K:SICO,1993/7/8,317595,HK716,HK0716002271
Ultronics Intl Holdings Ltd,1993/7/12,1993/7/12,,ULNC,3823,Ultronics Intl Holdings Ltd,0,ltronics,0,Alltronics Holdings,Alltronics Holdings,ALLTRONICS HOLDINGS,K:ALLT,2005/7/15,31294M,HK833,KYG022791266
Four Seas Mercantile Hldgs Ltd,1993/8/10,1993/8/10,HK0008703743,374,2051,Four Seas Mercantile Hldgs Ltd,0,fourseasmercant,0,Four Seas Mercantile,Four Seas Mercantile,FOUR SEAS MERCANTILE,K:FOUS,1993/8/25,317673,HK374,KYG365451049
Yeebo(International Holdings),1993/8/17,1993/8/17,BMG9835B1000,YEEB,3873,Yeebo(International Holdings),0,yeebo,0,Yeebo (International Holdings),Yeebo (International Holdings),YEEBO (INTL.HDG.),K:YEEB,1993/9/1,317697,HK259,BMG9835R1051
Kingboard Chemical Holdings,1993/9/22,1993/9/22,,148,3672,Kingboard Chemical Holdings,0,kingboardchemic,0,Kingboard Chemical Holdings,Kingboard Chemical Holdings,KINGBOARD CHEMICAL HDG.,K:KINC,1993/10/8,317789,HK148,KYG525621408
Oriental Watch Holdings Ltd,1993/9/24,1993/9/24,,398,5944,Oriental Watch Holdings Ltd,0,orientalwatch,0,Oriental Watch Holdings,Oriental Watch Holdings,ORIENTAL WATCH HDG.,K:ORWA,1993/10/12,317795,HK398,BMG6773R1051
Siu-Fung Ceramics Holdings,1993/10/12,1993/10/12,,SUIF,5084,Siu-Fung Ceramics Holdings,0,siu-fungceramic,0,SIU-Fung Ceramics,SIU-Fung Ceramics,SIU-FUNG CERAMICS,K:SIUF,1993/10/28,317819,NA,NA
Yaohan International Holdings,1993/10/14,1993/10/14,,700,7389,Yaohan International Holdings,0,yaohan,0,Yaohan Hongkong,Yaohan Hongkong,YAOHAN HONGKONG,27580D,2003/9/12,27580D,NA,NA
Yugang International Ltd,1993/10/21,1993/10/21,BMG9880B1046,613,5013,Yugang International Ltd,0,yugang,0,Yugang International,Yugang International,YUGANG INTERNATIONAL,K:YUGA,1993/11/12,315418,HK613,BMG9880B1384
Esprit Holdings Ltd,1993/11/23,1993/11/23,,330,2321,Esprit Holdings Ltd,0,esprit,0,Esprit Holdings,Esprit Holdings,ESPRIT HOLDINGS,K:ESPR,1993/12/9,356831,HK330,BMG3122U1457
Theme International Holdings,1994/1/10,1994/1/10,BMG8800F1041,990,5621,Theme International Holdings,0,theme,0,Theme International Holdings,Theme International Holdings,THEME INTERNATIONAL HDG.,K:THEM,1994/1/25,362000,HK990,BMG8800F1876
Win Win Intl Hldg Ltd,1994/1/31,1994/1/31,BMG9719J1045,WINW,3552,Win Win Intl Hldg Ltd,0,winwin,0,Win Win Way Construction Holdings,Win Win Way Construction Holdings,WIN WIN WAY CON. HDG.,K:WWWC,2017/7/17,9112KW,HK994,KYG972041043
Matrix Holdings Ltd,1994/2/1,1994/2/1,BMG5888V1000,MATX,3999,Matrix Holdings Ltd,0,matrix,0,Matrix Holdings,Matrix Holdings,MATRIX HOLDINGS,K:MATR,1994/2/18,362075,HK1005,BMG5888V1265
Daiwa Associate Holdings Ltd,1994/3/24,1994/3/24,BMG2625R1043,1037,3679,Daiwa Associate Holdings Ltd,0,associate,0,Associated International Hotels,Associated International Hotels,ASSOCIATED INTL.HOTELS,K:AIH,1988/6/1,755880,HK105,HK0105000613
Ngai Hing Hong Co Ltd,1994/4/8,1994/4/8,,1047,2821,Ngai Hing Hong Co Ltd,0,ngaihinghong,0,Ngai Hing Hong,Ngai Hing Hong,NGAI HING HONG,K:NGAH,1994/4/25,362425,HK1047,BMG650311092
Kingmaker Footwear Holdings,1994/9/13,1994/9/13,,1170,3143,Kingmaker Footwear Holdings,0,kingmakerfootwe,0,Kingmaker Footwear Holdings,Kingmaker Footwear Holdings,KINGMAKER FOOTWEAR HDG.,K:KIFO,1994/9/29,140472,HK1170,BMG5256W1029
SAS Dragon Holdings Ltd,1994/9/29,1994/9/29,BMG7814X1359,1184,3679,SAS Dragon Holdings Ltd,0,sasdragon,0,SAS Dragon Holdings,SAS Dragon Holdings,SAS DRAGON HOLDINGS,K:SASD,1994/10/17,140537,HK1184,BMG7814X1011
Easyknit Intl Hldg Ltd,1995/1/16,1995/1/16,BMG2915Q1217,1218,2253,Easyknit Intl Hldg Ltd,0,easyknit,0,Easyknit International Holdings,Easyknit International Holdings,EASYKNIT INTL.HDG.,K:EASY,1995/1/30,140953,HK1218,BMG2915Q3296
