issuer,Idate,Fdate,ISIN,ticker,SIC,LCS Key,LevDis Key,LCS,LevDis Value,LCS Value,Full Name,Name,Symbol,Start Date,DATASTREAM CODE,LOC OFF. CODE,ISIN CODE
Dream International Ltd,2002/2/6,2002/1/29,,1126,3942,Dream International Ltd,0,dream,0,Dream International,Dream International,DREAM INTERNATIONAL,K:DREA,2002/2/7,15173F,HK1126,HK1126010854
Water Oasis Group Ltd,2002/2/27,2002/2/27,,1161,5999,Water Oasis Group Ltd,0,wateroasis,0,Water Oasis Group,Water Oasis Group,WATER OASIS GROUP,K:H2O,2002/3/11,15275N,HK1161,KYG9477E1070
Fu Cheong Intl Hldg Ltd,2002/3/25,2002/3/22,,916,3955,Fu Cheong Intl Hldg Ltd,0,fucheong,0,Fu Cheong International Holdings,Fu Cheong International Holdings,FU CHEONG INTL.HOLDINGS,K:FCHE,2002/3/27,15351X,NA,KYG3684E1098
Natural Beauty Bio-Tech Ltd,2002/3/26,2002/3/19,,157,2841,Natural Beauty Bio-Tech Ltd,0,naturalbeautybi,0,Natural Beauty Biotechnology,Natural Beauty Biotechnology,NATURAL BEAUTY BIOTECH.,K:NBBT,2002/3/28,15358J,HK157,KYG640061027
Greenfield Chemical Holdings,2002/4/26,2002/4/18,,582,5198,Greenfield Chemical Holdings,0,nfieldchemi,0,Manfield Chemical Holdings,Manfield Chemical Holdings,MANFIELD CHEMICAL HDG.,K:MACF,2015/12/1,8735AW,HK1561,NA
Sino Prosper Holdings Ltd,2002/4/30,2002/4/30,,766,1521,Sino Prosper Holdings Ltd,0,sinoprosper,0,Sino Prosper (Group) Holdings,Sino Prosper (Group) Holdings,SINO PSPR.(GROUP) HDG.,K:SPRO,2002/5/15,25508T,HK766,KYG8190S1122
Harbin Brewery Group Ltd,2002/6/21,2002/6/10,,249,2082,Harbin Brewery Group Ltd,0,harbinbrewery,0,Harbin Brewery Group,Harbin Brewery Group,HARBIN BREWERY GROUP,K:HBRE,2002/6/27,25704D,HK249,NA
Global Trend Intelligent Tech,2002/6/26,2002/6/18,,691,8742,Global Trend Intelligent Tech,0,globaltrendinte,0,Global Trend Intelligent Technologies,Global Trend Intelligent Technologies,GLB.TREND INTEL.TECHS.,K:GTIT,2002/6/28,25724V,NA,KYG393531002
BYD Co Ltd,2002/7/26,2002/7/22,CN0006617467,1211,3711,BYD Co Ltd,0,byd,0,Jnby Design,Jnby Design,JNBY DESIGN,K:JNBY,2016/10/31,2637YH,HK3306,KYG550441045
Inno-Tech Holdings Ltd,2002/7/30,2002/7/30,,8202,7373,Inno-Tech Holdings Ltd,0,inno-tech,0,Inno-Technology Holdings,Inno-Technology Holdings,INNO-TECH HOLDINGS,K:ITEC,2002/8/12,26098J,HK8202,BMG4782R2731
Sinotrans Ltd,2003/2/7,2003/1/23,CN0001729671,598,4512,Sinotrans Ltd,0,sinotrans,0,Sinotrans Shipping,Sinotrans Shipping,SINOTRANS SHIPPING,K:SINT,2007/11/23,51283T,HK368,HK0368041528
ChinaSoft International Ltd,2003/6/10,2003/6/10,,354,7372,ChinaSoft International Ltd,0,chinasoft,0,Chinasoft International,Chinasoft International,CHINASOFT INTERNATIONAL,K:CSFT,2003/6/20,27155W,HK354,KYG2110A1114
Bonjour Holdings Ltd,2003/7/9,2003/6/30,KYG123731096,653,5999,Bonjour Holdings Ltd,0,bonjour,0,Bonjour Holdings,Bonjour Holdings,BONJOUR HOLDINGS,K:BONJ,2003/7/16,27273V,HK653,KYG123731252
Comba Telecom Sys Hldg Ltd,2003/7/10,2003/6/30,,2342,3663,Comba Telecom Sys Hldg Ltd,0,combatelecomsys,0,Comba Telecom Systems Holdings,Comba Telecom Systems Holdings,COMBA TELECOM SYS.HDG.,K:COMB,2003/7/15,27260X,HK2342,KYG229721140
Leeport(Holdings)Ltd,2003/7/10,2003/6/27,BMG542851040,387,3569,Leeport(Holdings)Ltd,0,leeport,0,Leeport (Holdings),Leeport (Holdings),LEEPORT (HOLDINGS),K:LPRT,2003/7/10,27251H,HK387,BMG542851040
Dawnrays Pharmaceutical Ltd,2003/7/11,2003/6/30,KYG2687M1006,2348,2834,Dawnrays Pharmaceutical Ltd,0,dawnrayspharmac,0,Dawnrays Pharmaceutical (Holdings),Dawnrays Pharmaceutical (Holdings),DAWNRAYS PHARM.(HDG.),K:DWNP,2003/7/11,27257L,HK2348,KYG2687M1006
Hopewell Highway,2003/7/31,2003/7/14,,737,1611,Hopewell Highway,0,hopewellhighway,0,Hopewell Highway Infrastructure,Hopewell Highway Infrastructure,HOPEWELL HGHWY.INFR.,K:HOWL,2003/8/6,27337M,HK737,KYG459951003
Hop Fung Group Holdings Ltd,2003/9/15,2003/9/15,,2320,2679,Hop Fung Group Holdings Ltd,0,hopfung,0,Hop Fung Group Holdings,Hop Fung Group Holdings,HOP FUNG GROUP HDG.,K:HPFG,2003/9/24,27623E,HK2320,KYG459991025
AviChina Ind & Tech Co Ltd,2003/10/25,2003/1/11,,2357,3721,AviChina Ind & Tech Co Ltd,0,chinaind,0,China Industrial Securities International,China Industrial Securities International,CHINA INDL.SECS.INTL.,K:CISI,2016/10/20,2625M3,HK8407,KYG212101029
Chia Hsin Cement Greater China,2003/12/2,2003/12/2,,699,3241,Chia Hsin Cement Greater China,0,chiahsincementg,0,Chia Hsin Cement Greater China,Chia Hsin Cement Greater China,CHIA HSIN CMT.GTR.CHINA,K:CHIA,2003/12/12,28208J,UG2099610,KYG209961070
China Oriental Group Co Ltd,2004/2/23,2004/2/9,BMG2108V1019,581,3316,China Oriental Group Co Ltd,0,chinaoriental,0,China Oriental Group,China Oriental Group,CHINA ORIENTAL GROUP,K:CHOR,2004/3/2,28534W,HK581,BMG2108V1019
China Resources Peoples Tele,2004/3/29,2004/2/28,,331,4812,China Resources Peoples Tele,0,chinaresourcesp,0,China Resources Power Holdings,China Resources Power Holdings,CHINA RES.POWER HDG.,K:CREP,2003/11/12,27962U,HK836,HK0836012952
AMS Public Transport Hldgs Ltd,2004/3/30,2004/3/30,,77,4119,AMS Public Transport Hldgs Ltd,0,amspublictransp,0,AMS Public Transport Holdings,AMS Public Transport Holdings,AMS PUBLIC TRAN.HDG.,K:AMS,2004/4/15,28833W,HK77,KYG041561088
Solomon Systech(Intl)Ltd,2004/3/31,2004/2/28,,2878,3674,Solomon Systech(Intl)Ltd,0,solomonsystech,0,Solomon Systech (International),Solomon Systech (International),SOLOMON SYSTECH (INTL.),K:SOLO,2004/4/8,28795F,HK2878,KYG826051099
Lifestyle Intl Hldgs Ltd,2004/4/8,2004/1/17,KYG548561029,1212,5311,Lifestyle Intl Hldgs Ltd,0,lifestyle,0,Lifestyle International Holdings,Lifestyle International Holdings,LIFESTYLE INTL.HDG.,K:LIFS,2004/4/15,28798E,HK1212,KYG548561284
China Mengniu Dairy Co Ltd,2004/6/5,2004/5/17,KYG210961051,2319,2026,China Mengniu Dairy Co Ltd,0,chinamengniudai,0,China Mengniu Dairy,China Mengniu Dairy,CHINA MENGNIU DAIRY,K:MNDA,2004/6/10,29042F,HK2319,KYG210961051
Tencent Holdings Ltd,2004/6/10,2004/5/31,KYG875721063,700,7375,Tencent Holdings Ltd,0,tencent,0,Tencent Holdings,Tencent Holdings,TENCENT HOLDINGS,K:TCNT,2004/6/16,29061M,HK700,KYG875721634
Li Ning Co Ltd,2004/6/19,2004/6/11,KYG5496K1085,2331,3949,Li Ning Co Ltd,0,lining,0,Li Ning,Li Ning,LI NING,K:LNIN,2004/6/28,29101D,HK2331,KYG5496K1242
Pacific Basin Shipping Ltd,2004/7/8,2004/6/14,,2343,4499,Pacific Basin Shipping Ltd,0,pacificbasinshi,0,Pacific Basin Shipping,Pacific Basin Shipping,PACIFIC BASIN SHIP.,K:PBSH,2004/7/14,29168W,HK2343,BMG684371393
Luen Thai Holdings Ltd,2004/7/9,2004/6/30,KYG5697P1046,311,2331,Luen Thai Holdings Ltd,0,luenthai,0,Luen Thai Holdings,Luen Thai Holdings,LUEN THAI HOLDINGS,K:LTHA,2004/7/15,29168X,HK311,KYG5697P1046
Zhongtian International Ltd,2004/9/15,2004/9/10,KYG989151041,2379,7373,Zhongtian International Ltd,0,zhongtian,0,Zhongtian International,Zhongtian International,ZHONGTIAN INTERNATIONAL,K:ZTIN,2004/9/22,29515H,HK2379,KYG989151207
Kam Hing Intl Hldg Ltd,2004/9/18,2004/9/14,,2307,2299,Kam Hing Intl Hldg Ltd,0,kamhing,0,Kam Hing International Holdings,Kam Hing International Holdings,KAM HING INTL.HDG.,K:KAMH,2004/9/23,29547W,HK2307,KYG5213T1013
China Shineway Pharm Grp Ltd,2004/11/27,2004/11/15,,2877,2834,China Shineway Pharm Grp Ltd,0,chinashinewayph,0,China Shineway Pharmaceutical Group,China Shineway Pharmaceutical Group,CHINA SHINEWAY PHARM.GP.,K:CSPG,2004/12/2,298293,HK2877,KYG2110P1000
Texhong Textile Group Ltd,2004/11/30,2004/11/30,,2678,2211,Texhong Textile Group Ltd,0,texhongtextile,0,Texhong Textile Group,Texhong Textile Group,TEXHONG TEXTILE GP.,K:TTGL,2004/12/9,29874E,HK2678,KYG876551170
Air China Ltd,2004/12/9,2004/11/25,CN000A0DNWD6,753,4512,Air China Ltd,0,air,0,Hong Kong Aircraft Engineering,Hong Kong Aircraft Engineering,HONG KONG AIRCRAFT ENGR.,K:HKAC,1973/1/1,929711,HK44,HK0044000302
Beijing Media Corp Ltd,2004/12/17,2004/12/10,CN000A0DN2F0,1000,2731,Beijing Media Corp Ltd,0,beijingmedia,0,Beijing Media 'H',Beijing Media 'H',BEIJING MEDIA 'H',54223E,2008/10/21,54223E,NA,NA
Dynasty Fine Wines Group Ltd,2005/1/21,2005/1/17,KYG2950W1087,828,2084,Dynasty Fine Wines Group Ltd,0,dynastyfinewine,0,Dynasty Fine Wines Group,Dynasty Fine Wines Group,DYNASTY FINE WINES GP.,K:DFWG,2005/1/26,29941E,HK828,KYG2950W1087
Xinyi Glass Holdings Ltd,2005/1/28,2005/1/24,KYG9828G1082,868,3231,Xinyi Glass Holdings Ltd,0,xinyiglass,0,Xinyi Glass Holdings,Xinyi Glass Holdings,XINYI GLASS HOLDINGS,K:XINY,2005/2/3,30185X,HK868,KYG9828G1082
New Focus Auto Tech Holdings,2005/2/23,2005/2/17,KYG645451090,360,3711,New Focus Auto Tech Holdings,0,newfocusauto,0,New Focus Auto Technology Holdings,New Focus Auto Technology Holdings,NEW FOCUS AUTO TECH HDG.,K:NFOC,2005/2/28,30342X,HK360,KYG645451090
Shanghai Elec Grp Co Ltd,2005/4/27,2005/4/18,CN000A0EABT1,2727,3568,Shanghai Elec Grp Co Ltd,0,shanghaielec,0,Shanghai Electric Group Company,Shanghai Electric Group Company,SHANGHAI ELECTRIC GP.CO.,32497P,2005/12/6,32497P,NA,NA
EVA Precision Ind Hldg Ltd,2005/5/5,2005/4/29,KYG321481015,838,3542,EVA Precision Ind Hldg Ltd,0,evaprecisionind,0,Eva Precision Industrial Holdings,Eva Precision Industrial Holdings,EVA PRECISION INDL.HDG.,K:EVAP,2005/5/11,30906K,HK838,KYG321481015
Sandmartin Intl Hldg Ltd,2005/5/5,2005/4/28,BMG780521008,482,3679,Sandmartin Intl Hldg Ltd,0,sandmartin,0,Sandmartin International Holdings,Sandmartin International Holdings,SANDMARTIN INTL.HOLDINGS,K:SAND,2005/5/12,30906J,HK482,BMG780521008
Bauhaus Intl(Hldg)Ltd,2005/5/6,2005/4/29,KYG1080K1094,483,5699,Bauhaus Intl(Hldg)Ltd,0,bauhaus,0,Bauhaus International Holdings,Bauhaus International Holdings,BAUHAUS INTL.HDG.,K:BAUH,2005/5/12,30906L,HK483,KYG1080K1094
Kenford Group Holdings Ltd,2005/6/6,2005/5/31,KYG523301003,464,3634,Kenford Group Holdings Ltd,0,kenford,0,Kenford Group Holdings,Kenford Group Holdings,KENFORD GROUP HOLDINGS,K:KENG,2005/6/16,30976T,HK464,KYG523301003
China Glass Holdings Ltd,2005/6/17,2005/6/13,BMG2111H1079,3300,3211,China Glass Holdings Ltd,0,chinaglass,0,China Glass Holdings,China Glass Holdings,CHINA GLASS HOLDINGS,K:CHGL,2005/6/23,31203P,HK3300,BMG2111H1236
Jolimark Holdings Ltd,2005/6/23,2005/6/20,KYG516941005,2028,3679,Jolimark Holdings Ltd,0,jolimark,0,Jolimark Holdings,Jolimark Holdings,JOLIMARK HOLDINGS,K:JOLI,2005/6/29,31254P,HK2028,KYG516941005
China COSCO Holdings Co Ltd,2005/6/25,2005/6/20,CN000A0ERWH6,1919,4412,China COSCO Holdings Co Ltd,0,chinacosco,0,China Cosco Holdings Company,China Cosco Holdings Company,CHINA COSCO HOLDINGS CO.,32497T,2005/12/6,32497T,NA,NA
Alltronics Holdings Ltd,2005/7/15,2005/6/30,KYG022791266,833,3679,Alltronics Holdings Ltd,0,alltronics,0,Alltronics Holdings,Alltronics Holdings,ALLTRONICS HOLDINGS,K:ALLT,2005/7/15,31294M,HK833,KYG022791266
Sinochem Hong Kong Hldg Ltd,2005/7/21,2005/7/13,BMG8165Y1286,297,5191,Sinochem Hong Kong Hldg Ltd,0,sinochem,0,Sinochem Hong Kong Holdings,Sinochem Hong Kong Holdings,SINOCHEM HONG KONG HDG.,41203E,2006/9/15,41203E,NA,NA
Hong Kong Economic Times,2005/7/28,2005/7/22,KYG4587A1031,423,2731,Hong Kong Economic Times,0,hongkongeconomi,0,Hong Kong Economic Times,Hong Kong Economic Times,HONG KONG ECON.TIMES,K:HECO,2005/8/3,31421C,HK423,KYG4587A1031
China Yurun Food Group Ltd,2005/9/23,2005/9/3,BMG211591018,1068,2011,China Yurun Food Group Ltd,0,chinayurunfood,0,China Yurun Food Group,China Yurun Food Group,CHINA YURUN FOOD GROUP,K:CYUR,2005/10/3,31898D,HK1068,BMG211591018
Hengdeli Holdings Ltd,2005/9/23,2005/9/14,KYG450481083,3389,5094,Hengdeli Holdings Ltd,0,hengdeli,0,Hengdeli Holdings,Hengdeli Holdings,HENGDELI HOLDINGS,K:XHEN,2005/9/26,31764Q,HK3389,KYG450481083
AddChance Holdings Ltd,2005/10/5,2005/9/23,KYG0108P1081,3344,2299,AddChance Holdings Ltd,0,addchance,0,Addchance Holdings,Addchance Holdings,ADDCHANCE HOLDINGS,K:ADDC,2005/10/5,31923V,HK3344,KYG0108Q1064
China Paradise Electrn Retail,2005/10/7,2005/9/9,KYG215751085,503,5722,China Paradise Electrn Retail,0,chinaparadiseel,0,China Paradise Electronics Retail,China Paradise Electronics Retail,CHINA PARADISE ELTN.RET.,K:CPAR,2005/10/14,31966U,NA,KYG215751085
Sincere Watch(Hong Kong)Ltd,2005/10/12,2005/9/30,KYG814791003,444,5094,Sincere Watch(Hong Kong)Ltd,0,sincerewatch,0,Sincere Watch (Hong Kong),Sincere Watch (Hong Kong),SINCERE WATCH (HK.),K:SINW,2005/10/17,31949V,HK444,KYG814791268
One Media Group Ltd,2005/10/12,2005/9/30,KYG6752K1058,426,2721,One Media Group Ltd,0,onemedia,0,One Media Group,One Media Group,ONE MEDIA GROUP,K:OMG,2005/10/18,31749M,HK426,KYG6752K1058
Tradelink Electn Commerce Ltd,2005/10/21,2005/10/18,HK0536032532,536,7375,Tradelink Electn Commerce Ltd,0,tradelinkelect,0,Tradelink Electronic Commerce,Tradelink Electronic Commerce,TRADELINK ELT.COM.,K:TLEC,2005/10/28,32111P,HK536,HK0536032532
Ju Teng Intl Hldg Ltd,2005/10/29,2005/10/25,KYG521051063,3336,3577,Ju Teng Intl Hldg Ltd,0,juteng,0,Ju Teng International Holdings,Ju Teng International Holdings,JU TENG INTL.HDG.,K:JUTE,2005/11/3,32176D,HK3336,KYG521051063
Shenzhou International Group,2005/11/10,2005/11/8,KYG8087W1015,2313,2253,Shenzhou International Group,0,shenzhou,0,Shenzhou International Group Holdings,Shenzhou International Group Holdings,SHENZHOU INTL.GP.HDG.,K:SZIN,2005/11/24,32307F,HK2313,KYG8087W1015
China Infrastructure Machinery,2005/11/11,2005/11/7,KYG2111M1069,3339,3531,China Infrastructure Machinery,0,chinainfrastruc,0,China Infrastructure Invesment,China Infrastructure Invesment,CHINA INFR.INVESMENT,K:DAWA,1993/10/5,317765,HK600,KYG2112P1081
Samson Holding Ltd,2005/11/11,2005/11/7,KYG7783W1006,531,2511,Samson Holding Ltd,0,samson,0,Samsonite International,Samsonite International,SAMSONITE INTERNATIONAL,K:SAM,2011/6/16,77218J,HK1910,LU0633102719
Parkson Retail Group Ltd,2005/11/23,2005/11/14,KYG693701073,3368,5999,Parkson Retail Group Ltd,0,parksonretail,0,Parkson Retail Group,Parkson Retail Group,PARKSON RETAIL GROUP,K:PARK,2005/11/30,32344U,HK3368,KYG693701156
Minth Group Ltd,2005/11/28,2005/11/6,KYG6145U1094,425,3711,Minth Group Ltd,0,minth,0,Minth Group,Minth Group,MINTH GROUP,K:MINT,2005/12/1,32361L,HK425,KYG6145U1094
China Flavors & Fragrances Co,2005/12/6,2005/11/30,KYG2111P1090,3318,2087,China Flavors & Fragrances Co,0,chinaflavorsfra,0,China Flavors and Fragrances,China Flavors and Fragrances,CHINA FLAVORS AND FRAG.,K:CFAF,2005/12/9,32457F,HK3318,KYG2111P1090
Good Friend Intl Hldgs Inc,2006/1/5,2005/12/30,KYG398001001,2398,3541,Good Friend Intl Hldgs Inc,0,goodfriend,0,Good Friend International Holdings,Good Friend International Holdings,GOOD FRIEND INTL.HDG.,K:GTIN,2006/1/11,32631E,HK2398,KYG398001001
Modern Beauty Salon Holdings,2006/2/8,2006/1/7,KYG618101003,919,7231,Modern Beauty Salon Holdings,0,modernbeautysal,0,Modern Beauty Salon Holdings,Modern Beauty Salon Holdings,MODERN BEAUTY SALON HDG.,K:MOBS,2006/2/9,32748W,HK919,KYG618101003
Yorkey Optical International,2006/2/9,2006/1/19,KYG984571078,2788,3999,Yorkey Optical International,0,yorkeyoptical,0,Yorkey Optical International (Cayman),Yorkey Optical International (Cayman),YORKEY OPTC.INTL.(CYMN.),K:YOOP,2006/2/10,32743H,HK2788,KYG984571078
Nine Dragons Paper(Hldg)Ltd,2006/2/24,2006/2/13,BMG653181005,2689,2621,Nine Dragons Paper(Hldg)Ltd,0,ninedragonspape,0,Nine Dragons Paper Holdings,Nine Dragons Paper Holdings,NINE DRAGONS PAPER HDG.,K:NDRA,2006/3/3,32836U,HK2689,BMG653181005
Co-Prosperity Holdings Ltd,2006/3/24,2006/3/11,KYG2421Y1052,707,2299,Co-Prosperity Holdings Ltd,0,prosperity,0,Prosperity International Holdings Hong Kong,Prosperity International Holdings Hong Kong,PROSPERITY INTL.HDG.HK,K:PRSP,2001/8/2,14400D,HK803,BMG7274T1457
Air China Ltd,2006/8/8,2006/7/31,CN000A0DNWD6,753,4512,Air China Ltd,0,air,0,Hong Kong Aircraft Engineering,Hong Kong Aircraft Engineering,HONG KONG AIRCRAFT ENGR.,K:HKAC,1973/1/1,929711,HK44,HK0044000302
Win Hanverky Holdings Ltd,2006/8/31,2006/5/13,KYG9716W1087,3322,2299,Win Hanverky Holdings Ltd,0,winhanverky,0,Win Hanverky Holdings,Win Hanverky Holdings,WIN HANVERKY HOLDINGS,K:WINH,2006/9/6,41149L,HK3322,KYG9716W1087
Jutal Offshore Oil Svcs Ltd,2006/9/19,2006/9/11,KYG520771075,3303,3533,Jutal Offshore Oil Svcs Ltd,0,jutaloffshoreoi,0,Jutal Offshore Oil Services,Jutal Offshore Oil Services,JUTAL OFFSHORE OIL SVS.,K:JUTA,2006/9/21,41192V,HK3303,KYG520771075
Lee Kee Holdings Ltd,2006/9/28,2006/9/18,KYG542761039,637,3365,Lee Kee Holdings Ltd,0,leekee,0,Lee Kee Holdings,Lee Kee Holdings,LEE KEE HOLDINGS,K:LEEK,2006/10/4,41218Q,HK637,KYG542761039
Computime Group Ltd,2006/9/29,2006/9/19,KYG2341T1031,320,3679,Computime Group Ltd,0,computime,0,Computime Group,Computime Group,COMPUTIME GROUP,K:COMG,2006/10/9,41225M,HK320,KYG2341T1031
HannStar Board Intl Hldgs Ltd,2006/10/5,2006/6/7,KYG4280A1031,667,3672,HannStar Board Intl Hldgs Ltd,0,hannstarboard,0,Hannstar Board International Holdings,Hannstar Board International Holdings,HANNSTAR BOARD INTL.HDG.,K:HABI,2006/10/6,41227R,HK667,KYG4280A1031
NagaCorp Ltd,2006/10/14,2006/8/26,KYG6382M1096,3918,7011,NagaCorp Ltd,0,nagacorp,0,Nagacorp,Nagacorp,NAGACORP,K:NAGA,2006/10/19,41259H,HK3918,KYG6382M1096
Tiande Chemical Holdings Ltd,2006/10/26,2006/10/17,KYG887551060,609,2899,Tiande Chemical Holdings Ltd,0,tiandechemical,0,Tiande Chemical Holdings,Tiande Chemical Holdings,TIANDE CHEMICAL HDG.,K:TCHL,2006/10/27,41282K,HK609,KYG887551060
Aupu Group Holding Co Ltd,2006/11/30,2006/11/18,KYG063571007,477,3639,Aupu Group Holding Co Ltd,0,aupu,0,Aupu Group Holding,Aupu Group Holding,AUPU GROUP HOLDING,K:AUPU,2006/12/8,41429J,HK477,KYG063571007
Kingboard Laminates Hldg Ltd,2006/11/30,2006/8/26,KYG5257K1076,1888,3083,Kingboard Laminates Hldg Ltd,0,kingboardlamina,0,Kingboard Laminates Holdings,Kingboard Laminates Holdings,KINGBOARD LAMINATES HDG.,K:KILA,2006/12/7,41429U,HK1888,KYG5257K1076
Neo-Neon Holdings Ltd,2006/12/8,2006/11/27,KYG642571015,1868,3648,Neo-Neon Holdings Ltd,0,neo-neon,0,Neo-Neon Holdings,Neo-Neon Holdings,NEO-NEON HOLDINGS,K:NEON,2006/12/15,41452M,HK1868,KYG642571015
Kingdom Holdings Ltd,2006/12/11,2006/11/30,KYG525741032,528,2282,Kingdom Holdings Ltd,0,kingdom,0,KFM Kingdom Holdings,KFM Kingdom Holdings,KFM KINGDOM HOLDINGS,K:KFMK,2012/10/15,87699P,HK3816,KYG525551027
Scud Group Ltd,2006/12/15,2006/12/8,KYG794371024,1399,3691,Scud Group Ltd,0,scud,0,Scud Group,Scud Group,SCUD GROUP,K:SCUD,2006/12/21,41473D,HK1399,KYG794371024
Haitian Intl Holdings Ltd,2006/12/16,2006/12/7,KYG4232C1087,1882,3089,Haitian Intl Holdings Ltd,0,haitian,0,Haitian International Holdings,Haitian International Holdings,HAITIAN INTL.HOLDINGS,K:HAIT,2006/12/22,41473C,HK1882,KYG4232C1087
Wuyi Intl Pharmaceutical Co,2007/1/26,2007/1/17,KYG980891082,1889,2835,Wuyi Intl Pharmaceutical Co,0,pharmaceuti,0,CSPC Pharmaceutical Group,CSPC Pharmaceutical Group,CSPC PHARMACEUTICAL GP.,K:CPHA,1994/6/21,140134,HK1093,HK1093012172
Fufeng Group Ltd,2007/1/31,2005/1/7,KYG368441013,546,2899,Fufeng Group Ltd,0,fufeng,0,Fufeng Group,Fufeng Group,FUFENG GROUP,K:FUFE,2007/2/8,41688L,HK546,KYG368441195
China Huiyuan Juice Group Ltd,2007/2/14,2007/2/5,KYG211231074,1886,2037,China Huiyuan Juice Group Ltd,0,chinahuiyuanjui,0,China Huiyuan Juice Group,China Huiyuan Juice Group,CHINA HUIYUAN JUICE GP.,K:CHUI,2007/2/23,50079J,HK1886,KYG211231074
Ajisen(China)Holdings Ltd,2007/3/23,2007/3/12,KYG0192S1093,538,5812,Ajisen(China)Holdings Ltd,0,ajisen,0,Ajisen (China) Holdings,Ajisen (China) Holdings,AJISEN(CHINA)HOLDINGS,K:AJIS,2007/3/30,50313X,HK538,KYG0192S1093
Capxon Intl Electronic Co Ltd,2007/5/4,2007/4/24,KYG1892A1094,469,3674,Capxon Intl Electronic Co Ltd,0,capxonelectroni,0,Capxon International Electronic,Capxon International Electronic,CAPXON INTL.ELECTRONIC,K:CAPX,2007/5/7,50448X,HK469,KYG1892A1094
Pacific Textiles Holdings Ltd,2007/5/11,2007/5/2,KYG686121032,1382,2257,Pacific Textiles Holdings Ltd,0,pacifictextiles,0,Pacific Textiles Holdings,Pacific Textiles Holdings,PACIFIC TEXTILES HDG.,K:PTHL,2007/5/18,50513H,HK1382,KYG686121032
Jiahua Stores Holdings Ltd,2007/5/18,2007/5/8,KYG7395Y1061,602,5411,Jiahua Stores Holdings Ltd,0,jiahuastores,0,Jiahua Stores Holdings,Jiahua Stores Holdings,JIAHUA STORES HOLDINGS,K:JSHH,2007/5/21,50517D,HK602,KYG7395Y1061
Walker Group Holdings Ltd,2007/6/1,2007/5/21,KYG261411048,1386,5661,Walker Group Holdings Ltd,0,walker,0,Slater Walker Hong Kong,Slater Walker Hong Kong,SLATER WALKER HONG KONG,929096,1973/1/1,929096,NA,NA
Tianneng Power Intl Ltd,2007/6/8,2007/5/8,KYG8655K1094,819,3691,Tianneng Power Intl Ltd,0,tiannengpower,0,Tianneng Power International,Tianneng Power International,TIANNENG POWER INTL.,K:TPIL,2007/6/11,50610L,HK819,KYG8655K1094
Sunny Optical Tech(Grp)Co Ltd,2007/6/9,2007/5/28,KYG8586D1097,2382,3861,Sunny Optical Tech(Grp)Co Ltd,0,sunnyoptical,0,Sunny Optical Technology (Group),Sunny Optical Technology (Group),SUNNY OPTICAL TECH.(GP.),K:SOPT,2007/6/15,50631X,HK2382,KYG8586D1097
Ka Shui Intl Holdings Ltd,2007/6/12,2007/6/12,KYG5217R1011,822,3356,Ka Shui Intl Holdings Ltd,0,kashui,0,Ka Shui International Holdings,Ka Shui International Holdings,KA SHUI INTL.HOLDINGS,K:KSHU,2007/6/27,50662X,HK822,KYG5217R1011
China COSCO Holdings Co Ltd,2007/6/20,2007/6/8,CNE100000601,1919,4412,China COSCO Holdings Co Ltd,0,chinacosco,0,China Cosco Holdings Company,China Cosco Holdings Company,CHINA COSCO HOLDINGS CO.,32497T,2005/12/6,32497T,NA,NA
China High Speed Transmission,2007/6/25,2007/6/14,KYG2112D1051,658,3568,China High Speed Transmission,0,chinahighspeedt,0,China High Speed Transmission Equipment Group,China High Speed Transmission Equipment Group,CHINA HISPD.TNSM.EQU.GP.,K:CHSP,2007/7/4,50693J,HK658,KYG2112D1051
Centron Telecom International,2007/6/26,2007/6/21,KYG202011022,1155,4813,Centron Telecom International,0,centrontelecom,0,Centron Telecom International Holding,Centron Telecom International Holding,CENTRON TELC.INTL.HLDG.,K:CTRT,2007/7/5,50699R,HK1155,KYG202011022
China Medical Systems Hldg Ltd,2007/6/26,2007/6/6,KYG211081081,867,2834,China Medical Systems Hldg Ltd,0,chinamedical,0,China Medical and Healthcare Group,China Medical and Healthcare Group,CHINA MED.& HLTHCR.GP.,K:PAGI,1991/8/1,314156,HK383,BMG2133H1016
Stella International Hldgs Ltd,2007/6/28,2007/6/18,KYG846981028,1836,3143,Stella International Hldgs Ltd,0,stella,0,Stella International Holdings,Stella International Holdings,STELLA INTL.HOLDINGS,K:STLI,2007/7/6,50707F,HK1836,KYG846981028
Tao Heung Holdings Ltd,2007/6/28,2007/5/31,KYG8672Y1089,573,5812,Tao Heung Holdings Ltd,0,taoheung,0,Tao Heung Holdings,Tao Heung Holdings,TAO HEUNG HOLDINGS,K:TAOH,2007/6/29,50676J,HK573,KYG8672Y1089
Delta Networks Inc,2007/6/29,2007/3/3,KYG271481080,722,3669,Delta Networks Inc,0,deltanetworks,0,Delta Networks,Delta Networks,DELTA NETWORKS,K:DELT,2007/7/6,50707H,NA,KYG271481080
ANTA Sports Products Ltd,2007/6/30,2007/4/21,KYG040111059,2020,2253,ANTA Sports Products Ltd,0,antasportsprodu,0,Anta Sports Products,Anta Sports Products,ANTA SPORTS PRODUCTS,K:ANIT,2007/7/10,50722E,HK2020,KYG040111059
Times Ltd,2007/7/6,2007/5/16,KYG887821000,1832,5411,Times Ltd,0,times,0,Times Property Holdings,Times Property Holdings,TIMES PROPERTY HOLDINGS,K:TPHS,2013/12/11,93670C,HK1233,KYG8904A1004
Regent Manner Intl Hldgs Ltd,2007/7/9,2007/6/25,KYG7481P1000,1997,3674,Regent Manner Intl Hldgs Ltd,0,regentmanner,0,Regent Manner International Holdings,Regent Manner International Holdings,REGENT MANNER INTL.HDG.,K:REGM,2007/7/10,50721J,NA,KYG7481P1182
China Automation Group Ltd,2007/7/11,2007/6/28,KYG2112N1034,569,7382,China Automation Group Ltd,0,chinaautomation,0,China Automation Group,China Automation Group,CHINA AUTOMATION GROUP,K:CAUG,2007/7/12,50759Q,HK569,KYG2112N1117
Tiangong International Co Ltd,2007/7/20,2007/7/6,KYG888311050,826,3317,Tiangong International Co Ltd,0,tiangong,0,Tiangong International,Tiangong International,TIANGONG INTERNATIONAL,K:TIIC,2007/7/26,50820R,HK826,KYG888311134
Global Sweeteners Holdings Ltd,2007/9/14,2007/5/9,KYG3932Q1029,3889,2087,Global Sweeteners Holdings Ltd,0,globalsweetener,0,Global Sweeteners Holdings,Global Sweeteners Holdings,GLOBAL SWEETENERS HDG.,K:GSWE,2007/9/20,50947V,HK3889,KYG3932Q1029
Hidili Industry International,2007/9/14,2007/6/4,KYG444031069,1393,1221,Hidili Industry International,0,hidiliindustry,0,Hidili Industry International Development,Hidili Industry International Development,HIDILI IND.INTL.DEV.,K:HIDI,2007/9/21,510587,HK1393,KYG444031069
Qunxing Paper Holdings Co Ltd,2007/9/20,2007/8/27,KYG7329J1004,3868,2621,Qunxing Paper Holdings Co Ltd,0,qunxingpaper,0,Qunxing Paper Holdings,Qunxing Paper Holdings,QUNXING PAPER HOLDINGS,K:QNXG,2007/10/2,51077X,HK3868,KYG7329J1004
China Starch Holdings Ltd,2007/9/25,2007/9/11,KYG2161A1013,3838,2046,China Starch Holdings Ltd,0,chinastarch,0,China Starch Holdings,China Starch Holdings,CHINA STARCH HOLDINGS,K:CSTC,2007/9/27,51066L,HK3838,KYG2161A1195
Dachan Food(Asia)Ltd,2007/9/25,2007/9/14,KYG261441086,3999,2011,Dachan Food(Asia)Ltd,0,dachanfoodasia,0,Dachan Food (Asia),Dachan Food (Asia),DACHAN FOOD (ASIA),K:DCHN,2007/10/4,51092Q,HK3999,KYG261441086
Kingsoft Corp Ltd,2007/9/28,2007/9/17,KYG5264Y1089,3888,7372,Kingsoft Corp Ltd,0,kingsoft,0,Kingsoft,Kingsoft,KINGSOFT,K:KINS,2007/10/9,51100N,HK3888,KYG5264Y1089
Bosideng Intl Hldg Ltd,2007/10/3,2007/5/7,KYG126521064,3998,2299,Bosideng Intl Hldg Ltd,0,bosideng,0,Bosideng International Holdings,Bosideng International Holdings,BOSIDENG INTL.HOLDINGS,K:BOSI,2007/10/11,51117X,HK3998,KYG126521064
China Dongxiang(Group)Co Ltd,2007/10/3,2007/8/22,KYG2112Y1098,3818,3949,China Dongxiang(Group)Co Ltd,0,chinadongxiang,0,China Dongxiang (Group),China Dongxiang (Group),CHINA DONGXIANG (GROUP),K:CHDN,2007/10/10,51103R,HK3818,KYG2112Y1098
Dah Chong Hong Holdings Ltd,2007/10/10,2007/8/1,HK1828040670,1828,5511,Dah Chong Hong Holdings Ltd,0,dahchonghong,0,Dah Chong Hong Holdings,Dah Chong Hong Holdings,DAH CHONG HONG HOLDINGS,K:DAHC,2007/10/17,51080L,HK1828,HK1828040670
Ming Fai International,2007/10/25,2007/10/18,KYG6141X1079,3828,2841,Ming Fai International,0,mingfai,0,Ming Fai International Holdings,Ming Fai International Holdings,MING FAI INTL.HOLDINGS,K:MNGI,2007/11/2,51214U,HK3828,KYG6141X1079
